{
  "schema_version": 3,
  "title": "AI 客服发布：让下一步被看见",
  "mode": "imagegen",
  "catalog_scope": "authoring",
  "theme_ref": "campaign/bold-poster",
  "theme_recipe_sha256": "53ea1dc0afbda9c4f0d8fea72934928d3963e816694763c50078bcfe2fb26d03",
  "deck_spec_sha256": "88abed95b419b99cbf66113c5ff70b6130db0d81c4bd5a4845206020d73fdc01",
  "provider": "imagegen",
  "canvas": "16:9",
  "slides": [
    {
      "id": "s01",
      "index": 1,
      "role": "process",
      "visual_scheme_ref": "campaign/bold-poster/campaign-flow",
      "visual_scheme_sha256": "955244be2d74ebb6a124d49ad3eed742c0595500d7ce1dc4f4a10b7fb6cd3398",
      "prompt_sha256": "6e3d5fb9b5ba8f964374bc073fbd83ea0543b449c1494dd609b3160177740112",
      "model": "imagegen",
      "size": "2048x1152",
      "quality": "medium",
      "output_path": "slides/s01.png",
      "status": "pass",
      "attempts": 1,
      "error": null,
      "asset_role": "complete-slide",
      "text_policy": "exact-text-in-image",
      "visual_review": "pass",
      "review_notes": "95/100：三段提问、判断、行动沿一条单向路径推进，主张与阶段文字准确；左上文字区清晰，圆形图标形成统一色块锚点，红蓝黄配色符合 campaign-flow；原始 1672x941 保存在 slides/_original-1672x941/s01.png，最终为 2048x1152。",
      "reviewed_at": "2026-08-16T11:04:13.775Z"
    },
    {
      "id": "s02",
      "index": 2,
      "role": "data",
      "visual_scheme_ref": "campaign/bold-poster/campaign-data",
      "visual_scheme_sha256": "9bd8e2940c3c6b8c0a0ccb1700624e2d81cc5b088dd3beea61e3252068bd9fe7",
      "prompt_sha256": "5699f04f718662a2e5ff04ade8b1fc2f708e6467a257a9a5b4057d5d58f05bf9",
      "model": "imagegen",
      "size": "2048x1152",
      "quality": "medium",
      "output_path": "slides/s02.png",
      "status": "pass",
      "attempts": 2,
      "error": null,
      "asset_role": "complete-slide",
      "text_policy": "exact-text-in-image",
      "visual_review": "pass",
      "review_notes": "96/100：标题缩为左上两行中小结论，右侧环形三段成为主视觉；理解、选择、继续均准确，文字区安静，主题色与 campaign-data 一致；RightAPI 原始 1672x941 保存在 slides/_original-1672x941/s02-v2.png，最终按项目约定为 2048x1152。",
      "reviewed_at": "2026-08-16T10:58:51.524Z"
    },
    {
      "id": "s03",
      "index": 3,
      "role": "quote",
      "visual_scheme_ref": "campaign/bold-poster/campaign-signal",
      "visual_scheme_sha256": "e75612ee68c8e731f02a508f67535fc15c3944fb1b6a86c18fe7fed46ee3f9b8",
      "prompt_sha256": "163f101d751af12eaef4ff38da54c78258d50b2a489589f6c13110792398eef5",
      "model": "imagegen",
      "size": "2048x1152",
      "quality": "medium",
      "output_path": "slides/s03.png",
      "status": "pass",
      "attempts": 1,
      "error": null,
      "asset_role": "complete-slide",
      "text_policy": "exact-text-in-image",
      "visual_review": "pass",
      "review_notes": "96/100：左侧只保留两行 exact quote 与一行支持句，右侧单一红蓝传播标记形成锚点；文字与高频笔触分离，主题色、纸面材质和低密度节奏符合 campaign-signal；原始 1672x941 保存在 slides/_original-1672x941/s03.png，最终为 2048x1152。",
      "reviewed_at": "2026-08-16T11:02:33.996Z"
    }
  ]
}
