{
  "schema_version": 3,
  "title": "客服体验：把关系继续下去",
  "mode": "imagegen",
  "catalog_scope": "authoring",
  "theme_ref": "editorial/paper-magazine",
  "theme_recipe_sha256": "e573c097f090f1ce9dc4c5803089488ca454e29cce2ab3403300696807d34ebe",
  "deck_spec_sha256": "d42ab58fc890baf8606a3617fc04a1e2199876cde387556ffd49b46b8051ebaa",
  "provider": "imagegen",
  "canvas": "16:9",
  "slides": [
    {
      "id": "s01",
      "index": 1,
      "role": "image-hero",
      "visual_scheme_ref": "editorial/paper-magazine/documentary-hero",
      "visual_scheme_sha256": "438357ad53e41f75c73169cd91565334ec3bfc01655e5939bc37095cd765d04f",
      "prompt_sha256": "4aceb53a4b8dc69591c84b49c5fcd2d9b0aea87c291793ae6cbc07dc0ff33010",
      "model": "imagegen",
      "size": "2048x1152",
      "quality": "medium",
      "output_path": "slides/s01.png",
      "status": "pass",
      "attempts": 1,
      "error": null,
      "asset_role": "complete-slide",
      "text_policy": "exact-text-in-image",
      "visual_review": "pass",
      "review_notes": "文字与纪录式构图通过；左侧纸面安全区清楚，主体没有进入文字。约 96/100。",
      "reviewed_at": "2026-08-16T07:32:56.944Z"
    },
    {
      "id": "s02",
      "index": 2,
      "role": "quote",
      "visual_scheme_ref": "editorial/paper-magazine/profile-feature",
      "visual_scheme_sha256": "f07970e17f5adf7d30cdcf7810d4c864866ebacb7359b369db08954677140c9e",
      "prompt_sha256": "730eef8bb047a6c916f2dc0ccf526d3b3c8492aaec135bc9a919f57a64b5cac2",
      "model": "imagegen",
      "size": "2048x1152",
      "quality": "medium",
      "output_path": "slides/s02.png",
      "status": "pass",
      "attempts": 1,
      "error": null,
      "asset_role": "complete-slide",
      "text_policy": "exact-text-in-image",
      "visual_review": "pass",
      "review_notes": "引文与人物特写分区清楚；两行文字准确，脸部与文字安全区分离。约 96/100。",
      "reviewed_at": "2026-08-16T07:32:57.029Z"
    },
    {
      "id": "s03",
      "index": 3,
      "role": "comparison",
      "visual_scheme_ref": "editorial/paper-magazine/comparison-spread",
      "visual_scheme_sha256": "480ff6fb1427e8fc5c8972d746d10d3ffaf3393d603c08f9318bf2c9e023d3f0",
      "prompt_sha256": "53463f79919edab18213181d3d885d470f194e6bd8a5210f1307f273fcc995c5",
      "model": "imagegen",
      "size": "2048x1152",
      "quality": "medium",
      "output_path": "slides/s03.png",
      "status": "pass",
      "attempts": 1,
      "error": null,
      "asset_role": "complete-slide",
      "text_policy": "exact-text-in-image",
      "visual_review": "pass",
      "review_notes": "比较维度一致；两侧说明和橙色关系线可读，未出现第三选项或伪数据。约 95/100。",
      "reviewed_at": "2026-08-16T07:32:57.119Z"
    },
    {
      "id": "s04",
      "index": 4,
      "role": "closing",
      "visual_scheme_ref": "editorial/paper-magazine/collage-scene",
      "visual_scheme_sha256": "b14664928b310dc9b2d710f686e90055c06ed1585e0cde15d59ee97730844e2d",
      "prompt_sha256": "329c3f98ea1cfe209a102ec6257b5b6668fce8bac0dbbd6659631ae5162be533",
      "model": "imagegen",
      "size": "2048x1152",
      "quality": "medium",
      "output_path": "slides/s04.png",
      "status": "pass",
      "attempts": 1,
      "error": null,
      "asset_role": "complete-slide",
      "text_policy": "exact-text-in-image",
      "visual_review": "pass",
      "review_notes": "拼贴收束成立；两条 exact text 准确，空白便签没有额外可读文字。约 96/100。",
      "reviewed_at": "2026-08-16T07:32:57.207Z"
    }
  ]
}
