{
  "schema_version": 3,
  "title": "AI 客服：一条可治理的服务闭环",
  "mode": "imagegen",
  "catalog_scope": "authoring",
  "theme_ref": "systems/white-cyan-circuit",
  "theme_recipe_sha256": "e4d16d8b55d46d648ad0b15e9d16a444fed7e692f4f72c45f40bfa491cc0155d",
  "deck_spec_sha256": "0fc9d84708e984d059f7107bd4824b15d52a0977b53cea817944fac72f8b6e44",
  "provider": "imagegen",
  "canvas": "16:9",
  "slides": [
    {
      "id": "s01",
      "index": 1,
      "role": "process",
      "visual_scheme_ref": "systems/white-cyan-circuit/system-map",
      "visual_scheme_sha256": "fb58db8202946bea8fa571bdc36b4a7dfb4eb4c3c38bee691d6e2ba64f19fdc4",
      "prompt_sha256": "a24e59b02ab9c69fbcb134cca7a509ebf301bc17a4e1e0cd3a546dea0229bf11",
      "model": "imagegen",
      "size": "2048x1152",
      "quality": "medium",
      "output_path": "slides/s01.png",
      "status": "pass",
      "attempts": 1,
      "error": null,
      "asset_role": "complete-slide",
      "text_policy": "exact-text-in-image",
      "visual_review": "pass",
      "warning": "/Users/swimmingliu/data/github-proj/StoryWeave/examples/theme-showcase/systems-ai-customer-service/slides/s01.png is 1672x941; expected 2048x1152.",
      "review_notes": "95/100；中心闭环与六个能力节点关系明确；青蓝信号、白底和文字安全区通过；无伪数据。",
      "reviewed_at": "2026-08-15T17:19:05.805Z"
    },
    {
      "id": "s02",
      "index": 2,
      "role": "comparison",
      "visual_scheme_ref": "systems/white-cyan-circuit/comparison-matrix",
      "visual_scheme_sha256": "b620e8172e15c463dca6af1ffe4ebc5725373a1f0aec92ac9d858706d271d8bf",
      "prompt_sha256": "121f86775317218b6d04d4f726cc4a0603872994bf2c3fe5edfcba81ccc1faab",
      "model": "imagegen",
      "size": "2048x1152",
      "quality": "medium",
      "output_path": "slides/s02.png",
      "status": "pass",
      "attempts": 1,
      "error": null,
      "asset_role": "complete-slide",
      "text_policy": "exact-text-in-image",
      "visual_review": "pass",
      "warning": "/Users/swimmingliu/data/github-proj/StoryWeave/examples/theme-showcase/systems-ai-customer-service/slides/s02.png is 1672x941; expected 2048x1152.",
      "review_notes": "95/100；单点回答与服务闭环的对照关系清楚；上下文循环是主视觉；文字准确且可投影阅读。",
      "reviewed_at": "2026-08-15T17:19:05.899Z"
    },
    {
      "id": "s03",
      "index": 3,
      "role": "closing",
      "visual_scheme_ref": "systems/white-cyan-circuit/keynote-cover",
      "visual_scheme_sha256": "42ebb74cbcf8ba277c128e9662a228964ccae843aabb41d4b8d1240d9fb03e52",
      "prompt_sha256": "6aa7fa22bbe141bedc44000d381d13c3866defb251a2948c38edcaf73b0da850",
      "model": "imagegen",
      "size": "2048x1152",
      "quality": "medium",
      "output_path": "slides/s03.png",
      "status": "pass",
      "attempts": 1,
      "error": null,
      "asset_role": "complete-slide",
      "text_policy": "exact-text-in-image",
      "visual_review": "pass",
      "warning": "/Users/swimmingliu/data/github-proj/StoryWeave/examples/theme-showcase/systems-ai-customer-service/slides/s03.png is 1672x941; expected 2048x1152.",
      "review_notes": "96/100；左侧判断与右侧可追踪闭环形成明确阅读顺序；背景信号克制，留白安全。",
      "reviewed_at": "2026-08-15T17:19:05.993Z"
    }
  ]
}
