{
  "schema_version": 3,
  "title": "客服体验：从一次回答到一段连续关系",
  "mode": "imagegen",
  "catalog_scope": "authoring",
  "theme_ref": "editorial/paper-magazine",
  "theme_recipe_sha256": "e573c097f090f1ce9dc4c5803089488ca454e29cce2ab3403300696807d34ebe",
  "deck_spec_sha256": "b0875233b485b92a44760704127b4c623c27779aa6eff7452a9244f79ca47c7e",
  "provider": "imagegen",
  "canvas": "16:9",
  "slides": [
    {
      "id": "s01",
      "index": 1,
      "role": "cover",
      "visual_scheme_ref": "editorial/paper-magazine/magazine-cover",
      "visual_scheme_sha256": "c17d537f558fedbf91edf1a6065f5c546202c1e48a17388517eca1db6b85740d",
      "prompt_sha256": "3af0a685b9ef260570243422fdc5346881cb4d215ff68a3c950b3169a97fa766",
      "model": "imagegen",
      "size": "2048x1152",
      "quality": "medium",
      "output_path": "slides/s01.png",
      "status": "pass",
      "attempts": 1,
      "error": null,
      "asset_role": "complete-slide",
      "text_policy": "exact-text-in-image",
      "visual_review": "pass",
      "warning": "/Users/swimmingliu/data/github-proj/StoryWeave/examples/theme-showcase/editorial-customer-journey/slides/s01.png is 1672x941; expected 2048x1152.",
      "review_notes": "96/100；纸面留白、标题层级和右侧服务现场构图通过；文字准确且主体不侵入文字安全区。",
      "reviewed_at": "2026-08-15T17:19:05.540Z"
    },
    {
      "id": "s02",
      "index": 2,
      "role": "process",
      "visual_scheme_ref": "editorial/paper-magazine/editorial-diagram",
      "visual_scheme_sha256": "a80418ae08aa92e6f35aaad39e12b967df01b1559ef4f00f3d0615b31aec7726",
      "prompt_sha256": "40ccb42c80cc4ebb0d7ce81e9c3b3c35f9a36d6cfd0356d24ef03425472c322e",
      "model": "imagegen",
      "size": "2048x1152",
      "quality": "medium",
      "output_path": "slides/s02.png",
      "status": "pass",
      "attempts": 1,
      "error": null,
      "asset_role": "complete-slide",
      "text_policy": "exact-text-in-image",
      "visual_review": "pass",
      "warning": "/Users/swimmingliu/data/github-proj/StoryWeave/examples/theme-showcase/editorial-customer-journey/slides/s02.png is 1672x941; expected 2048x1152.",
      "review_notes": "96/100；四个动作沿墨线路径清晰可读；无额外数字或标签；文字安全区、纸张材质和留白通过。",
      "reviewed_at": "2026-08-15T17:19:05.618Z"
    },
    {
      "id": "s03",
      "index": 3,
      "role": "quote",
      "visual_scheme_ref": "editorial/paper-magazine/editorial-statement",
      "visual_scheme_sha256": "f5eecb41ce3326014de79dbf32476337c4924e6ff7d49acdda47c4a5bf4dd16a",
      "prompt_sha256": "76c05bc69b314fff3008587271a28e9653a3d5a4dfdd4ba361c6154a0348b298",
      "model": "imagegen",
      "size": "2048x1152",
      "quality": "medium",
      "output_path": "slides/s03.png",
      "status": "pass",
      "attempts": 1,
      "error": null,
      "asset_role": "complete-slide",
      "text_policy": "exact-text-in-image",
      "visual_review": "pass",
      "warning": "/Users/swimmingliu/data/github-proj/StoryWeave/examples/theme-showcase/editorial-customer-journey/slides/s03.png is 1672x941; expected 2048x1152.",
      "review_notes": "96/100；中等结论而非满版大标题；左侧留白、细红线和右侧路径主体形成平衡；文字准确。",
      "reviewed_at": "2026-08-15T17:19:05.709Z"
    }
  ]
}
