{
  "schema_version": 3,
  "title": "AI 客服：从回答开始，走向协作",
  "mode": "imagegen",
  "catalog_scope": "authoring",
  "theme_ref": "campaign/bold-poster",
  "theme_recipe_sha256": "53ea1dc0afbda9c4f0d8fea72934928d3963e816694763c50078bcfe2fb26d03",
  "deck_spec_sha256": "c8d1e074a48dfb89d90a686643bbbed4617fb12486883e6bade63dbdfdd5462e",
  "provider": "imagegen",
  "canvas": "16:9",
  "slides": [
    {
      "id": "s01",
      "index": 1,
      "role": "cover",
      "visual_scheme_ref": "campaign/bold-poster/poster-claim",
      "visual_scheme_sha256": "6a2d724655ab14f7be0f6fbc31f38d81a8415410ba4d2f527c246919353c0f9a",
      "prompt_sha256": "138eceea6337b99a75cb988244269ef149dd35dac7517d485599197f6a1b7f9f",
      "model": "imagegen",
      "size": "2048x1152",
      "quality": "medium",
      "output_path": "slides/s01.png",
      "status": "pass",
      "attempts": 1,
      "error": null,
      "asset_role": "complete-slide",
      "text_policy": "exact-text-in-image",
      "visual_review": "pass",
      "warning": "/Users/swimmingliu/data/github-proj/StoryWeave/examples/theme-showcase/campaign-ai-customer-service-launch/slides/s01.png is 1672x941; expected 2048x1152.",
      "review_notes": "96/100；海报式主张、红蓝路径和对话主体形成第一眼焦点；文字准确，传播层级清楚。",
      "reviewed_at": "2026-08-15T17:19:06.090Z"
    },
    {
      "id": "s02",
      "index": 2,
      "role": "image-hero",
      "visual_scheme_ref": "campaign/bold-poster/product-studio",
      "visual_scheme_sha256": "e281910784f21f17788e1a3d2253f7df4316ec9cb5da76b9e868a7acd71b41ad",
      "prompt_sha256": "fa88e8769636a44cc705d4d90538817b0f4d7b2f2ecb93009a83ccac73c748b6",
      "model": "imagegen",
      "size": "2048x1152",
      "quality": "medium",
      "output_path": "slides/s02.png",
      "status": "pass",
      "attempts": 1,
      "error": null,
      "asset_role": "complete-slide",
      "text_policy": "exact-text-in-image",
      "visual_review": "pass",
      "warning": "/Users/swimmingliu/data/github-proj/StoryWeave/examples/theme-showcase/campaign-ai-customer-service-launch/slides/s02.png is 1672x941; expected 2048x1152.",
      "review_notes": "96/100；产品主体单一，知识、工具和人工由一条光路连接；暗底对比与文字安全区通过。",
      "reviewed_at": "2026-08-15T17:19:06.182Z"
    },
    {
      "id": "s03",
      "index": 3,
      "role": "comparison",
      "visual_scheme_ref": "campaign/bold-poster/campaign-comparison",
      "visual_scheme_sha256": "22825b36d953826d33a6dc4444b35c5c25e679196872c85a822495254a0b4e93",
      "prompt_sha256": "62c480cc4cd76e41b478b4f97a0947eb76eb6f6a6c13cd67b365dbdf83853358",
      "model": "imagegen",
      "size": "2048x1152",
      "quality": "medium",
      "output_path": "slides/s03.png",
      "status": "pass",
      "attempts": 1,
      "error": null,
      "asset_role": "complete-slide",
      "text_policy": "exact-text-in-image",
      "visual_review": "pass",
      "warning": "/Users/swimmingliu/data/github-proj/StoryWeave/examples/theme-showcase/campaign-ai-customer-service-launch/slides/s03.png is 1672x941; expected 2048x1152.",
      "review_notes": "96/100；左右等重对照、统一维度和中间分界清楚；无第三选项或伪数据。",
      "reviewed_at": "2026-08-15T17:19:06.275Z"
    }
  ]
}
