{
  "schema_version": 3,
  "title": "夜间交接：同一条请求继续向前",
  "mode": "imagegen",
  "catalog_scope": "authoring",
  "theme_ref": "cinematic/natural-film",
  "theme_recipe_sha256": "aa7e111740bb22b08b8a4cca778563bf0162a74e5a4135c8ec21420498ba4315",
  "deck_spec_sha256": "16e6146f1ac0edf81c93a6f058ea408fa6f63c2905a525364a39a316164f1fd1",
  "provider": "imagegen",
  "canvas": "16:9",
  "slides": [
    {
      "id": "s01",
      "index": 1,
      "role": "comparison",
      "visual_scheme_ref": "cinematic/natural-film/film-comparison",
      "visual_scheme_sha256": "fbf2c69e3141bc8b5d771bdd547cc6fa015bf9d8d698bc70aa31ed295f367d71",
      "prompt_sha256": "5d6bf5c23f3969acc40ffaf65c90bcccf256b434d0b83008b33861265c7fd15d",
      "model": "imagegen",
      "size": "2048x1152",
      "quality": "medium",
      "output_path": "slides/s01.png",
      "status": "pass",
      "attempts": 1,
      "error": null,
      "asset_role": "complete-slide",
      "text_policy": "exact-text-in-image",
      "visual_review": "pass",
      "review_notes": "97/100：两幅夜间交接场景共享同一镜头尺度和城市窗景，接班前/接班后标签准确；左侧结论位于低纹理阴影区，人物、灯光和高频桌面没有穿过文字，符合 film-comparison；原始 1672x941 保存在 slides/_original-1672x941/s01.png，最终为 2048x1152。",
      "reviewed_at": "2026-08-16T11:26:58.121Z"
    },
    {
      "id": "s02",
      "index": 2,
      "role": "process",
      "visual_scheme_ref": "cinematic/natural-film/film-journey",
      "visual_scheme_sha256": "b6222a2bf55c429b9ab78cfc4d1683b2d068c56885ac57737c0b345fb2c49433",
      "prompt_sha256": "1f9650d9640bce88d5c705252ac0b3f2c7023344f3b9be8f5d3ca7925d957b5a",
      "model": "imagegen",
      "size": "2048x1152",
      "quality": "medium",
      "output_path": "slides/s02.png",
      "status": "pass",
      "attempts": 2,
      "error": null,
      "asset_role": "complete-slide",
      "text_policy": "exact-text-in-image",
      "visual_review": "pass",
      "review_notes": "96/100：连续走廊、窗边和服务台由同一光线方向串联，现场、交接、继续三段动作标签准确；左侧低纹理深色区保障文字可读，人物和灯光集中在右侧，符合 film-journey；首次下载出现 TLS UNEXPECTED_EOF_WHILE_READING，第二次请求成功；原始 1672x941 保存在 slides/_original-1672x941/s02.png，最终为 2048x1152。",
      "reviewed_at": "2026-08-16T11:44:38.688Z"
    },
    {
      "id": "s03",
      "index": 3,
      "role": "data",
      "visual_scheme_ref": "cinematic/natural-film/film-evidence",
      "visual_scheme_sha256": "5269c1dae88cfd516fd20864cfafae7ee3056ecd622191d045daeebdfc84ea34",
      "prompt_sha256": "e1347741072c2a6305f322bb7b91fde0610a1620f5e630a0e98a0c31ffd24e2b",
      "model": "imagegen",
      "size": "2048x1152",
      "quality": "medium",
      "output_path": "slides/s03.png",
      "status": "pass",
      "attempts": 1,
      "error": null,
      "asset_role": "complete-slide",
      "text_policy": "exact-text-in-image",
      "visual_review": "pass",
      "review_notes": "96/100：夜间工作台、交接手部和窗外现场形成一个真实观察场景；服务的连续性主张与现场线索、交接记录、下一步三段标签准确，证据线是次级视觉且不制造数字；文字位于低纹理左侧暗场，符合 film-evidence；原始 1672x941 保存在 slides/_original-1672x941/s03.png，最终为 2048x1152。",
      "reviewed_at": "2026-08-16T11:54:11.998Z"
    }
  ]
}
