{
  "schema_version": 3,
  "title": "AI 客服：从信号到交接",
  "mode": "imagegen",
  "catalog_scope": "authoring",
  "theme_ref": "systems/white-cyan-circuit",
  "theme_recipe_sha256": "e4d16d8b55d46d648ad0b15e9d16a444fed7e692f4f72c45f40bfa491cc0155d",
  "deck_spec_sha256": "50abe04898786728758d2db5be58725f615bf5bc5f27a12c00f3b1226855c030",
  "provider": "imagegen",
  "canvas": "16:9",
  "slides": [
    {
      "id": "s01",
      "index": 1,
      "role": "process",
      "visual_scheme_ref": "systems/white-cyan-circuit/circuit-flow",
      "visual_scheme_sha256": "eacb8f209d958e75281198643a595f435b3c1f321273a5c9aabb57eec17de534",
      "prompt_sha256": "0d95c57c4f8e02ae1770bfa0431ea1471fa1cb2f950d322c99e7417916f6713d",
      "model": "imagegen",
      "size": "2048x1152",
      "quality": "medium",
      "output_path": "slides/s01.png",
      "status": "pass",
      "attempts": 1,
      "error": null,
      "asset_role": "complete-slide",
      "text_policy": "exact-text-in-image",
      "visual_review": "pass",
      "review_notes": "96/100：四个节点接入、判断、调用、交接沿同一青蓝信号路径推进，箭头方向清楚；标题和节点文字准确，白底电路锚点统一，文字区无高频背景。",
      "reviewed_at": "2026-08-16T12:14:47.404Z"
    },
    {
      "id": "s02",
      "index": 2,
      "role": "data",
      "visual_scheme_ref": "systems/white-cyan-circuit/data-overview",
      "visual_scheme_sha256": "d1fc165ce2da9a14878228fe5e85da4fb772ca93734e797d02f6314f5339db5b",
      "prompt_sha256": "b3910890f5446379515e6adf43c518ee98f27f2a3c7086b76512daec369bae8e",
      "model": "imagegen",
      "size": "2048x1152",
      "quality": "medium",
      "output_path": "slides/s02.png",
      "status": "pass",
      "attempts": 1,
      "error": null,
      "asset_role": "complete-slide",
      "text_policy": "exact-text-in-image",
      "visual_review": "pass",
      "review_notes": "96/100：请求、上下文、动作、结果四个关系节点与中心环形系统保持一致；标题为左上中等结论，浅色背景高对比，未添加数字或伪数据。",
      "reviewed_at": "2026-08-16T12:14:47.461Z"
    },
    {
      "id": "s03",
      "index": 3,
      "role": "quote",
      "visual_scheme_ref": "systems/white-cyan-circuit/signal-quote",
      "visual_scheme_sha256": "5b50075f58934c0a7056223f5624fefa12cd88dca53405535c10a44adfb760b5",
      "prompt_sha256": "fa7f2bc06937c679433adc90af9ab74332cbf10398fb403722a46bc447fb7d87",
      "model": "imagegen",
      "size": "2048x1152",
      "quality": "medium",
      "output_path": "slides/s03.png",
      "status": "pass",
      "attempts": 2,
      "error": null,
      "asset_role": "complete-slide",
      "text_policy": "exact-text-in-image",
      "visual_review": "pass",
      "review_notes": "96/100：左侧两行系统判断与右侧单一路径关系形成结论到依据的阅读顺序；青蓝线路、节点和留白符合 signal-quote，s03 首次请求被内容策略拦截，改写 Communication purpose 后第二次成功。",
      "reviewed_at": "2026-08-16T12:14:47.536Z"
    },
    {
      "id": "s04",
      "index": 4,
      "role": "image-hero",
      "visual_scheme_ref": "systems/white-cyan-circuit/ui-concept",
      "visual_scheme_sha256": "024a6ef14e7f7923ab1682cb8529bc66f60a848f76a0c7d70cfbc1924ae87686",
      "prompt_sha256": "2f23a517f2cfd2554faec36c7886a6d910d4565ef56237c294e8e3a2b5aa3531",
      "model": "imagegen",
      "size": "2048x1152",
      "quality": "medium",
      "output_path": "slides/s04.png",
      "status": "pass",
      "attempts": 2,
      "error": null,
      "asset_role": "complete-slide",
      "text_policy": "exact-text-in-image",
      "visual_review": "pass",
      "review_notes": "95/100：概念界面只作为关系的视觉载体，中心关系与多条青蓝路径清楚；exact text 准确且没有额外 UI 文案，首次请求 HTTP 超时，使用 180 秒请求超时重试成功。",
      "reviewed_at": "2026-08-16T12:14:47.613Z"
    },
    {
      "id": "s05",
      "index": 5,
      "role": "image-hero",
      "visual_scheme_ref": "systems/white-cyan-circuit/isometric-space",
      "visual_scheme_sha256": "d953ae27a924ebf612465c6248832c39b0858c310030e9e135f76ebcb0033b25",
      "prompt_sha256": "d9c55fe50e2ad13bd9104e15cedecbce1ab0a28e436b85f287e9404f5bfd0b0d",
      "model": "imagegen",
      "size": "2048x1152",
      "quality": "medium",
      "output_path": "slides/s05.png",
      "status": "pass",
      "attempts": 2,
      "error": null,
      "asset_role": "complete-slide",
      "text_policy": "exact-text-in-image",
      "visual_review": "pass",
      "review_notes": "96/100：等距空间中的入口、知识、服务、交接和用户节点形成清晰空间路径；标题与 supporting line 准确，白底青蓝主题稳定，首次 TLS 请求失败后重试成功。",
      "reviewed_at": "2026-08-16T12:14:47.690Z"
    }
  ]
}
