{
  "schema_version": 3,
  "title": "夜间值班：服务仍然继续",
  "mode": "imagegen",
  "catalog_scope": "authoring",
  "theme_ref": "cinematic/natural-film",
  "theme_recipe_sha256": "aa7e111740bb22b08b8a4cca778563bf0162a74e5a4135c8ec21420498ba4315",
  "deck_spec_sha256": "242bc20063877681e8151177ed0e3f584e3b907b856e0b1c19e37439220a1136",
  "provider": "imagegen",
  "canvas": "16:9",
  "slides": [
    {
      "id": "s01",
      "index": 1,
      "role": "cover",
      "visual_scheme_ref": "cinematic/natural-film/film-opening",
      "visual_scheme_sha256": "6c8e036c90562c4eaa662cd49cf4c41982074ba04e9be2f09fcc482cbb5451df",
      "prompt_sha256": "81ed09fd6337085cba73c500290bf08ed78cd82d877ab0a677cb75c888d0be98",
      "model": "imagegen",
      "size": "2048x1152",
      "quality": "medium",
      "output_path": "slides/s01.png",
      "status": "pass",
      "attempts": 1,
      "error": null,
      "asset_role": "complete-slide",
      "text_policy": "exact-text-in-image",
      "visual_review": "pass",
      "warning": "/Users/swimmingliu/data/github-proj/StoryWeave/examples/theme-showcase/cinematic-night-operations/slides/s01.png is 1672x941; expected 2048x1152.",
      "review_notes": "95/100；夜间值班场景、城市窗光和人物尺度建立时间地点；左侧标题安全且无可读伪招牌。",
      "reviewed_at": "2026-08-15T17:19:06.369Z"
    },
    {
      "id": "s02",
      "index": 2,
      "role": "image-hero",
      "visual_scheme_ref": "cinematic/natural-film/human-moment",
      "visual_scheme_sha256": "6c0de60ee504aa0e967503b49827e35075ca901708a9b3ce09b372ce02cead25",
      "prompt_sha256": "0c330589518f2fea74969db850b4947af9ca2adc27e2b2a574290e199bd630b6",
      "model": "imagegen",
      "size": "2048x1152",
      "quality": "medium",
      "output_path": "slides/s02.png",
      "status": "pass",
      "attempts": 1,
      "error": null,
      "asset_role": "complete-slide",
      "text_policy": "exact-text-in-image",
      "visual_review": "pass",
      "warning": "/Users/swimmingliu/data/github-proj/StoryWeave/examples/theme-showcase/cinematic-night-operations/slides/s02.png is 1672x941; expected 2048x1152.",
      "review_notes": "96/100；人物动作与交接纸条支持主张；脸部和文字区分离，光线自然，文字准确。",
      "reviewed_at": "2026-08-15T17:19:06.460Z"
    },
    {
      "id": "s03",
      "index": 3,
      "role": "closing",
      "visual_scheme_ref": "cinematic/natural-film/quiet-ending",
      "visual_scheme_sha256": "85f929a65f6c0922b15be9346b9cfe7b8178689e4e95044aaec2a1c869abb475",
      "prompt_sha256": "4b9a320edc7f0648c8f42a0c3200d5d97ca8f1842668cea29349de8f6286eaf4",
      "model": "imagegen",
      "size": "2048x1152",
      "quality": "medium",
      "output_path": "slides/s03.png",
      "status": "pass",
      "attempts": 1,
      "error": null,
      "asset_role": "complete-slide",
      "text_policy": "exact-text-in-image",
      "visual_review": "pass",
      "warning": "/Users/swimmingliu/data/github-proj/StoryWeave/examples/theme-showcase/cinematic-night-operations/slides/s03.png is 1672x941; expected 2048x1152.",
      "review_notes": "96/100；暖光收束、离场动作和左下文字区形成安静结尾；没有额外口号或 Logo。",
      "reviewed_at": "2026-08-15T17:19:06.552Z"
    }
  ]
}
